id,publishedDate,title,url,description,source,tags,crawlDate,tickers
96223117,2026-06-05T21:45:04Z,Meta Platforms (META) Declines More Than Market: Some Information for Investors,https://www.zacks.com/stock/news/2933448/meta-platforms-meta-declines-more-than-market-some-information-for-investors?cid=CS-ZC-FT-tale_of_the_tape%7Cyseop_template_6-2933448,,zacks.com,"('ETF', 'Stock', 'Tale Of The Tape', 'Technology')",2026-06-05T22:49:09.920694Z,"('meta', 'meta', 'metv')"
96222386,2026-06-05T21:44:15Z,Meta Wants AI Agents to Become Its Next Ad Business,https://finance.yahoo.com/sectors/technology/articles/meta-wants-ai-agents-become-214415421.html,"Meta launched its business-facing AI agents across its three biggest platforms Wednesday, laying the groundwork for a revenue model that could go well beyond ads.",finance.yahoo.com,"('Ai Agents', 'ETF', 'Facebook', 'Meta', 'Stock', 'Technology')",2026-06-05T22:11:52.399744Z,"('meta', 'meta', 'metv', 'nvda')"
96221974,2026-06-05T21:30:00Z,"Nebius Stock Is Up 170% in 2026, and Leopold Aschenbrenner Just Bought a 5.6% Stake. Here's Why",https://www.fool.com/investing/2026/06/05/nebius-stock-is-up-170-in-2026-and-leopold-aschenb/?source=iedfolrf0000001,The AI infrastructure company still has a bright future.,fool.com,"('04055D54-Fe73-4Aca-8Cf6-6A7Fd9Ffc81A', 'Amzn', 'Consumer Cyclical', 'Crwv', 'ETF', 'Investing', 'Meta', 'Msft', 'Nbis', 'Nvda', 'Stock', 'Technology', 'Technology And Telecom', 'Unknown Sector')",2026-06-05T21:53:45.437002Z,"('amzn', 'crwv', 'meta', 'meta', 'metv', 'msft', 'nbis', 'nvda')"
96219847,2026-06-05T20:01:17Z,RAM Prices 2026: Buy Now or Wait as Gartner Forecasts 130% Memory Cost Surge,https://www.techtimes.com/articles/317872/20260605/ram-prices-2026-buy-now-wait-gartner-forecasts-130-memory-cost-surge.htm,"On June 3, Tom’s Hardware reported that the cheapest 32GB DDR5 kit available in the United States had climbed to $374.97, with no comparable option selling for less, a detail captured in its daily RAM price tracker.",techtimes.com,"('Artificial Intelligence', 'Communication Services', 'Ddr', 'ETF', 'Financials', 'Memory', 'Meta', 'Ram', 'Stock', 'Technology', 'United States', 'Unknown Sector')",2026-06-05T20:03:11.709644Z,"('ddr', 'intc', 'iqnt', 'it', 'meta', 'meta', 'metv', 'mu', 'ram')"
96219673,2026-06-05T19:48:02Z,"Meta Smart Glasses Facial Recognition Code Is Already on Millions of Phones, Wired Finds",https://www.techtimes.com/articles/317870/20260605/meta-smart-glasses-facial-recognition-code-already-millions-phones-wired-finds.htm,"The dormant NameTag system would let Meta smart glasses identify people, and the ACLU wants it scrapped.",techtimes.com,"('Artificial Intelligence', 'ETF', 'Facial Recognition', 'Meta', 'Stock', 'Technology')",2026-06-05T19:53:20.810029Z,"('goog', 'googl', 'meta', 'meta', 'metv')"
96220098,2026-06-05T19:37:26Z,META Stock Drops Nearly 7% In Afternoon Trading — Here’s What’s Driving The Selloff,https://finance.yahoo.com/markets/stocks/articles/meta-stock-drops-nearly-7-193726297.html,A report says Meta is exploring a potential equity raise as AI infrastructure spending ramps up and capital needs grow.,finance.yahoo.com,"('Capital Expenditures', 'Direct Competition', 'ETF', 'Equity Capital Markets', 'Meta', 'Stock', 'Technology', 'Unknown Sector')",2026-06-05T20:18:12.163138Z,"('goog', 'googl', 'meta', 'meta', 'metv', 'spcx')"
96218836,2026-06-05T19:05:58Z,Meta's stock sinks on report company could raise tens of billions of dollars to fund AI push,https://www.cnbc.com/2026/06/05/meta-stock-sinks-on-report-company-could-raise-tens-of-billions-for-ai.html,Meta shares dropped after the Financial Times reported that company could potentially raise tens of billions of dollars in a stock offering to help its AI push.,cnbc.com,"('Breaking News: Technology', 'Business', 'Computing', 'ETF', 'Enterprise', 'Internet', 'Social Media', 'Stock', 'Technology', 'Wireless')",2026-06-05T19:12:25.298812Z,"('googl', 'meta', 'meta', 'metv')"
96218555,2026-06-05T18:55:07Z,SpaceX is set to be a 'seminal event' for the stock market next week. Here's what's ahead,https://www.cnbc.com/2026/06/05/spacex-is-set-to-be-a-seminal-event-for-the-stock-market-next-week-heres-whats-ahead.html,What the first of several trillion dollar companies going public will mean for a stock market that's already at all-time highs.,cnbc.com,"('Consumer Cyclical', 'Consumer Defensive', 'ETF', 'Investment Strategy', 'Stock', 'Stock Markets', 'Technology', 'Tiingo Top', 'Unknown Sector')",2026-06-05T18:59:17.764968Z,"('adbe', 'casy', 'cpb', 'len', 'meta', 'meta', 'metv', 'mu', 'sjm', 'spcx', 'tsla')"
96218020,2026-06-05T18:25:07Z,"Meta quietly added facial recognition to smart glasses, sparking major privacy concerns: report",https://nypost.com/2026/06/05/business/meta-quietly-added-facial-recognition-code-to-smart-glasses-report/,"Meta has been quietly laying the groundwork for smart glasses that could identify people as wearers of the shades walk by, according to a report – causing privacy watchdogs to sound the alarm.  Mar…",nypost.com,"('Artificial Intelligence', 'ETF', 'Meta', 'Stock', 'Technology')",2026-06-05T18:28:00.689566Z,"('meta', 'meta', 'metv')"
96223296,2026-06-05T18:25:07Z,"Meta quietly added facial recognition to smart glasses, sparking major privacy concerns: report",https://www.aol.com/news/meta-quietly-added-facial-recognition-182507531.html,"Meta has been quietly laying the groundwork for smart glasses that could identify people as wearers of the shades walk by, according to a report – causing privacy watchdogs to sound the alarm. Mark Zuckerberg’s Meta has embedded facial-recognition technology for its smart glasses into an app downloaded to millions of phones, according to a report by Wired, which performed an analysis of the company's software.",aol.com,"('ETF', 'Facial Recognition', 'Glasses', 'Mark Zuckerberg', 'Meta', 'Smart Glasses', 'Stock', 'Technology')",2026-06-05T22:58:17.296696Z,"('meta', 'meta', 'metv')"
96223304,2026-06-05T18:25:07Z,"Meta quietly added facial recognition to smart glasses, sparking major privacy concerns: report",https://www.aol.com/news/meta-quietly-added-facial-recognition-182507839.html,"Meta has been quietly laying the groundwork for smart glasses that could identify people as wearers of the shades walk by, according to a report – causing privacy watchdogs to sound the alarm. Mark Zuckerberg’s Meta has embedded facial-recognition technology for its smart glasses into an app downloaded to millions of phones, according to a report by Wired, which performed an analysis of the company's software.",aol.com,"('ETF', 'Facial Recognition', 'Glasses', 'Mark Zuckerberg', 'Meta', 'Smart Glasses', 'Stock', 'Technology')",2026-06-05T22:58:57.413276Z,"('meta', 'meta', 'metv')"
96217748,2026-06-05T18:06:34Z,"As AI-related stocks dive, the market's winners have one thing in common",https://www.cnbc.com/2026/06/05/as-ai-related-stocks-dive-the-markets-winners-have-one-thing-in-common.html,"Every weekday, the Investing Club releases the Homestretch; an actionable afternoon update just in time for the last hour of trading.",cnbc.com,"('Breaking News: Markets', 'Consumer Cyclical', 'Consumer Defensive', 'ETF', 'Industrials', 'Investment Strategy', 'Markets', 'Stock', 'Technology', 'Tiingo Top', 'Unknown Sector')",2026-06-05T18:13:35.815749Z,"('aapl', 'adbe', 'amzn', 'avgo', 'casy', 'chwy', 'googl', 'hon', 'len', 'meta', 'meta', 'metv', 'orcl', 'sjm', 'tsla', 'xlk')"
96221818,2026-06-05T18:04:55Z,"Over 50 Analysts Rate META a Buy, Here’s Why We Agree",https://finance.yahoo.com/markets/stocks/articles/over-50-analysts-rate-meta-180455156.html,"I’m leading with the number because that’s why you’re here. Meta Platforms (NASDAQ:META) closed at $597.63 on June 2, 2026, down 9.39% year to date. Our 24/7 Wall St. price target for Meta is $868.05 over the next 12 months, implying 45.25% upside. The recommendation is buy with a 90% confidence score, our highest tier. ... Over 50 Analysts Rate META a Buy, Here’s Why We Agree",finance.yahoo.com,"('ETF', 'Financial Services', 'Meta', 'Meta Superintelligence Labs', 'Operating Margins', 'Reality Labs', 'Revenue Growth', 'Stock', 'Technology', 'Top 10 Ai Stocks')",2026-06-05T21:48:41.551144Z,"('meta', 'meta', 'metv', 'nvda', 'ry')"
96216819,2026-06-05T17:07:00Z,3 Artificial Intelligence (AI) Stocks to Buy and Hold for the Next Decade,https://www.fool.com/investing/2026/06/05/3-artificial-intelligence-ai-stocks-to-buy-and-hol/?source=iedfolrf0000001,Here are three companies with deep AI runways and the cash flow to keep investing through whatever the next decade brings.,fool.com,"('35B30703-0Bc3-4E8A-8C36-9D68Aa83B79C', 'Avgo', 'ETF', 'Investing', 'Meta', 'Msft', 'Stock', 'Technology', 'Technology And Telecom')",2026-06-05T17:31:47.369706Z,"('avgo', 'meta', 'meta', 'metv', 'msft')"
96216026,2026-06-05T16:59:20Z,Apple's WWDC: Tim Cook's AI legacy at stake in his final developer conference as CEO,https://www.cnbc.com/2026/06/05/apple-wwdc-tim-cook-ai-siri-ternus.html,"Apple heads into WWDC with Tim Cook’s AI legacy, Siri’s future as an agentic platform, and the stock’s rich valuation all on the line.",cnbc.com,"('Business', 'Computing', 'Consumer Cyclical', 'ETF', 'Energy', 'Entertainment', 'Financial Services', 'Internet', 'Iphone', 'Stock', 'Technology', 'Unknown Sector', 'Wireless')",2026-06-05T17:01:18.598027Z,"('aapl', 'amzn', 'googl', 'gs', 'igv', 'iyw', 'jpm', 'meta', 'meta', 'metv', 'msft', 'nvda', 'uber', 'xlk')"
96214396,2026-06-05T16:07:36Z,Meta Builds AI Data Centers in Tents: Strategy Halves Build Time Amid $145 Billion Bet,https://www.techtimes.com/articles/317862/20260605/meta-builds-ai-data-centers-tents-strategy-halves-build-time-amid-145-billion-bet.htm,"Meta is building AI data centers inside giant fabric tents to bring computing capacity online in roughly half the usual time, according to satellite imagery and city permits surfaced on June 4 by Cleanview Energy founder Michael Thomas.",techtimes.com,"('Business Tech', 'Data Center', 'ETF', 'Meta', 'Stock', 'Technology', 'Tents', 'Tiingo Top')",2026-06-05T16:08:12.592559Z,"('goog', 'googl', 'meta', 'meta', 'metv')"
96214048,2026-06-05T15:56:33Z,Meta AI Instagram Hack Outlasts Fix: Company Alerts Victims as Account Takeovers Continue,https://www.techtimes.com/articles/317861/20260605/meta-ai-instagram-hack-outlasts-fix-company-alerts-victims-account-takeovers-continue.htm,"Meta has started emailing Instagram users this week to warn that their accounts may have been compromised, days after attackers found they could seize profiles simply by asking Meta’s AI support chatbot to change the email address on someone else’s account.",techtimes.com,"('Artificial Intelligence', 'ETF', 'Hack', 'Instagram', 'Meta', 'Stock', 'Technology')",2026-06-05T15:57:11.615600Z,"('hack', 'meta', 'meta', 'metv')"
96215319,2026-06-05T15:30:30Z,Why Is Snap (SNAP) Up 1.5% Since Last Earnings Report?,https://www.zacks.com/stock/news/2933211/why-is-snap-snap-up-1-5-since-last-earnings-report?cid=CS-ZC-FT-realtime_blog-2933211,,zacks.com,"('ETF', 'Realtime Blog', 'Stock', 'Technology')",2026-06-05T16:47:37.888113Z,"('meta', 'meta', 'metv', 'snap')"
96213674,2026-06-05T15:15:00Z,"3 Top-Tech Stocks to Buy With $1,000 Right Now",https://www.fool.com/investing/2026/06/05/3-top-tech-stocks-to-buy-with-1000-right-now/?source=iedfolrf0000001,Not all of the market is near all-time highs.,fool.com,"('Cf246A1D-E557-4D55-Badf-F262B1760Fac', 'ETF', 'Investing', 'Meta', 'Msft', 'Nvda', 'Stock', 'Technology', 'Technology And Telecom')",2026-06-05T15:40:04.604125Z,"('meta', 'meta', 'metv', 'msft', 'nvda')"
96211431,2026-06-05T14:13:44Z,Amazon unveils latest warehouse robot as tech giants continue AI layoffs,https://www.cnbc.com/2026/06/05/amazon-robot-proteus-warehouse-ai-layoffs.html,"""Our experience of robots is that it's actually driven up employment rather than the reverse,"" Amazon executive John Boumphrey told CNBC.",cnbc.com,"('Artificial Intelligence', 'Breaking News: Technology', 'Business', 'Computing', 'Consumer Cyclical', 'ETF', 'Environment', 'Internet', 'Jobs', 'Layoffs', 'Personnel', 'Robotics', 'Stock', 'Technology', 'Wireless')",2026-06-05T14:17:29.258479Z,"('amzn', 'meta', 'meta', 'metv', 'msft', 'orcl', 'xyz')"
96211229,2026-06-05T13:45:00Z,Meta Stock Fell After Strong Earnings: Is It a Rare Buying Opportunity?,https://www.fool.com/investing/2026/06/05/meta-stock-fell-after-strong-earnings-is-it-a-rare/?source=iedfolrf0000001,"Meta's AI spending has Wall Street nervous, but its advertising machine may already be showing why the payoff could be bigger than investors expect.",fool.com,"('79B9349F-7560-40Fd-822B-3C8Be45999E7', 'ETF', 'Investing', 'Meta', 'Stock', 'Technology', 'Technology And Telecom')",2026-06-05T14:07:56.432522Z,"('meta', 'meta', 'metv')"
96210346,2026-06-05T13:15:50Z,Google vs. Meta: Which Ad Giant Is the Better Long-Term Buy?,https://finance.yahoo.com/markets/stocks/articles/google-vs-meta-ad-giant-131550827.html,"For retirement-focused investors weighing the two ad giants, the question is direct: Should you own Alphabet (NASDAQ:GOOGL) or Meta Platforms (NASDAQ:META) right now? Both print cash, both dominate digital advertising, and both are spending unprecedented sums on AI infrastructure. The market has rendered very different verdicts on each so far in 2026: Alphabet is up ... Google vs. Meta: Which Ad Giant Is the Better Long-Term Buy?",finance.yahoo.com,"('ETF', 'Googl', 'Google', 'Meta', 'Reality Labs', 'Stock', 'Technology')",2026-06-05T13:29:36.409454Z,"('goog', 'googl', 'meta', 'meta', 'metv', 'nvda')"
96208185,2026-06-05T12:00:01Z,Alphabet is seeking fresh capital as stock's 4-week losing streak tests investor appetite,https://www.cnbc.com/2026/06/05/alphabet-ai-data-center-financing.html,"Alphabet expects capex to reach up to $190 billion this year, double last year's spending, and the company is turning to investors to help fund its expansion.",cnbc.com,"('Breaking News: Markets', 'Breaking News: Technology', 'Business', 'Computing', 'Consumer Cyclical', 'ETF', 'Enterprise', 'Financial Services', 'Internet', 'Markets', 'Stock', 'Technology', 'Tiingo Top', 'Wireless')",2026-06-05T12:02:29.664669Z,"('amzn', 'baba', 'googl', 'gs', 'meta', 'meta', 'metv', 'nvda', 'xlk')"
96207055,2026-06-05T11:00:01Z,The Tech Download: Anthropic’s IPO sets up first big test of AI boom valuations,https://www.cnbc.com/2026/06/05/tech-download-anthropic-ipo-ai-valuations.html,Anthropic took a big step this week towards pipping bitter rival OpenAI to a public market listing.,cnbc.com,"('Breaking News: Technology', 'Business', 'Computing', 'ETF', 'Internet', 'Ipo', 'Stock', 'Technology', 'Unknown Sector', 'Wireless')",2026-06-05T11:02:32.120104Z,"('avgo', 'googl', 'meta', 'meta', 'metv', 'uber')"
96205627,2026-06-05T09:30:00Z,Meta Platforms Is Down 21% From Its All-Time High: Here's What History Says Will Happen Next,https://www.fool.com/investing/2026/06/05/meta-platforms-is-down-22-from-its-all-time-high-h/?source=iedfolrf0000001,Should you buy shares of the social media leader on the dip?,fool.com,"('A53F3A4C-9Fe9-4861-800E-9De0Dfb47Dc4', 'Aapl', 'ETF', 'Investing', 'Meta', 'Stock', 'Technology', 'Technology And Telecom')",2026-06-05T09:51:41.960148Z,"('aapl', 'meta', 'meta', 'metv')"
96206817,2026-06-05T09:23:00Z,"Zacks Investment Ideas feature highlights: Broadcom, Alphabet and Meta",https://www.zacks.com/stock/news/2932791/zacks-investment-ideas-feature-highlights-broadcom-alphabet-and-meta?cid=CS-ZC-FT-press_releases-2932791,,zacks.com,"('ETF', 'Press Releases', 'Stock', 'Technology')",2026-06-05T10:48:23.691092Z,"('avgo', 'brcm', 'googl', 'meta', 'meta', 'metv')"
96205835,2026-06-05T05:50:49Z,Anthropic: Self-improving AI systems may pose societal risks,https://fortune.com/2026/06/05/anthropic-self-improving-ai-systems-societal-risks/,"Plus: Airbnb, Anthropic, Arizona, AT&T, Canada, Cloudflare, IBM, Snap, SpaceX, Utah.",fortune.com,"('Ai Agents', 'Airbnb', 'Anthropic', 'Arizona', 'At&T', 'Brian Chesky', 'Canada', 'Cloudflare', 'Communication Services', 'Data Centers', 'ETF', 'Fortune Tech', 'Ibm', 'Meta', 'No Copyright', 'Snap Inc.', 'Spacex', 'Stock', 'Technology', 'Unknown Sector', 'Utah')",2026-06-05T09:55:25.538184Z,"('meta', 'meta', 'metv', 'spcx', 't')"
96202687,2026-06-05T05:46:04Z,China may move toward U.S. path on AI as firms poach employees,https://www.cnbc.com/2026/06/05/china-may-move-toward-us-path-on-ai-as-firms-poach-employees.html,"Tencent Chief AI Scientist Yao Shunyu, who joined the company from OpenAI, said Friday he aims to pursue artificial general intelligence.",cnbc.com,"('Breaking News: Technology', 'Business', 'China', 'Computing', 'Consumer Cyclical', 'ETF', 'Internet', 'Market Insider', 'Markets', 'Stock', 'Stock Markets', 'Technology', 'Tiingo Top', 'Unknown Sector', 'Wireless')",2026-06-05T05:54:18.395532Z,"('baba', 'bidu', 'googl', 'meta', 'meta', 'metv', 'tcehy', 'tme')"
96202898,2026-06-05T05:45:00Z,Why Is Jamie Dimon Giving the SpaceX IPO the Hard Sell?,https://www.fool.com/investing/2026/06/05/why-is-jamie-dimon-giving-the-spacex-ipo-the-hard/?source=iedfolrf0000001,The JPMorgan CEO is headlining the IPO roadshow.,fool.com,"('Bac', 'Consumer Cyclical', 'ETF', 'Eff45664-5Fc0-4D8E-A87E-10Ef1Dff2Cb8', 'Financial Services', 'Investing', 'Jpm', 'Meta', 'Ms', 'Stock', 'Technology', 'Technology And Telecom', 'Tsla', 'Uber', 'Unknown Sector')",2026-06-05T06:11:33.018468Z,"('bac', 'jpm', 'meta', 'meta', 'metv', 'ms', 'tsla', 'uber')"
96201339,2026-06-05T03:55:10Z,"Meta Rolls Out Instagram Plus Subscription to Global Users, Shares New Details About Its Features",https://www.techtimes.com/articles/317798/20260604/meta-rolls-out-instagram-plus-subscription-global-users-shares-new-details-about-its-features.htm,Meta has announced that the new Instagram Plus subscription is now accessible for global users and shares more details about it.,techtimes.com,"('Apps', 'ETF', 'Instagram', 'Instagram Plus Premium', 'Instagram Plus Subscription', 'Instagram Plus Subscription Features', 'Meta', 'Meta Instagram Plus', 'Software', 'Stock', 'Technology')",2026-06-05T03:56:42.422269Z,"('meta', 'meta', 'metv')"
96201386,2026-06-05T03:30:09Z,"Virginia Lottery Pick 3 Night, Pick 3 Day results for June 4, 2026",https://www.aol.com/news/virginia-lottery-pick-3-night-033009688.html,Check your tickets for Virginia daily lottery draw games here.,aol.com,"('ETF', 'Fb', 'Stock', 'Technology', 'Unknown Sector', 'Virginia Lottery')",2026-06-05T04:00:27.938129Z,"('fb', 'meta')"
96200250,2026-06-05T01:36:00Z,Which Growth Stock Is a Better Buy: Nvidia or Broadcom?,https://www.fool.com/investing/2026/06/04/which-growth-stock-is-a-better-buy-nvidia-or-broad/?source=iedfolrf0000001,"Both of these chip giants are central to the AI build-out, but one looks like the better buy today.",fool.com,"('Avgo', 'C03Ecdce-Eee5-49A5-B085-483D099B00F7', 'ETF', 'Goog', 'Googl', 'Investing', 'Meta', 'Nvda', 'Stock', 'Technology', 'Technology And Telecom', 'Tiingo Top')",2026-06-05T02:13:40.945178Z,"('avgo', 'brcm', 'goog', 'googl', 'meta', 'meta', 'metv', 'nvda')"
96199783,2026-06-05T01:34:34Z,Daily Open: Chips are down — but not for the Dow,https://www.cnbc.com/2026/06/05/iran-war-trump-ceasefire-chip-selloff-do-record.html,"Iran-backed Hezbollah rejected the U.S.-backed ceasefire terms agreed between Israel and Lebanon, demanding a full Israeli withdrawal first.",cnbc.com,"('Asia Economy', 'Basic Materials', 'Breaking News: Economy', 'Consumer Cyclical', 'ETF', 'Economy', 'Energy', 'Financial Services', 'Foreign Policy', 'Industrials', 'Iran', 'Israel', 'Lebanon', 'Stock', 'Technology', 'Tiingo Top', 'Unknown Sector')",2026-06-05T01:38:13.491347Z,"('aal', 'aapl', 'arkk', 'avgo', 'ba', 'bac', 'bno', 'bx', 'cf', 'cop', 'cvx', 'dal', 'dbo', 'ewh', 'ewj', 'ews', 'ewu', 'ewy', 'fdn', 'fdx', 'gbtc', 'googl', 'gs', 'ixc', 'jpm', 'kwt', 'kwt', 'lmt', 'mchi', 'meta', 'meta', 'metv', 'mos', 'mrvl', 'ms', 'msft', 'mstr', 'noc', 'ntr', 'nvda', 'orcl', 'oxy', 'qqq', 'shel', 'shel', 'socl', 'soxx', 'spgi', 'thd', 'tsla', 'tsm', 'tte', 'tte', 'ual', 'uco', 'uga', 'vgk', 'xar', 'xlk', 'xom', 'xsd')"
96198104,2026-06-04T23:21:00Z,"5 Top Artificial Intelligence (AI) Stocks to Buy With $5,000 Right Now",https://www.fool.com/investing/2026/06/04/5-top-ai-stocks-to-buy-with-5000-now/?source=iedfolrf0000001,The AI build-out continues to pick up steam.,fool.com,"('Aacf51Ef-C741-4023-8E4B-291E6C936C49', 'Amzn', 'Consumer Cyclical', 'ETF', 'Investing', 'Meta', 'Msft', 'Nbis', 'Nvda', 'Stock', 'Technology', 'Technology And Telecom')",2026-06-04T23:46:29.862213Z,"('amzn', 'meta', 'meta', 'metv', 'msft', 'nbis', 'nvda')"
96196544,2026-06-04T22:00:00Z,"The Stock Market Is Doing Something Unexpected Right Now, but History Has Good News for Investors",https://www.fool.com/investing/2026/06/04/the-stock-market-is-doing-something-unexpected-rig/?source=iedfolrf0000001,"The short term may be unpredictable, but the future is bright for long-term investors.",fool.com,"('1437B876-51B3-4Df2-B131-A7Cc0Ecf1782', 'Aapl', 'Amzn', 'Consumer Cyclical', 'ETF', 'Goog', 'Googl', 'Investing', 'Markets', 'Meta', 'Msft', 'Mu', 'Nvda', 'Stock', 'Technology', 'Tsla', '^Gspc')",2026-06-04T22:28:36.466450Z,"('aapl', 'amzn', 'goog', 'googl', 'meta', 'meta', 'metv', 'msft', 'mu', 'nvda', 'tsla')"
96194965,2026-06-04T20:55:00Z,Broadcom Could Be The Biggest AI Winner Nobody Is Talking About,https://www.fool.com/investing/2026/06/04/why-broadcom-could-be-the-biggest-ai-winner-nobody/?source=iedfolrf0000001,The tech giant's recent sell-off is a buying opportunity.,fool.com,"('Avgo', 'Db4Cc69A-B991-42Ec-Afa6-268738A52B47', 'ETF', 'Goog', 'Googl', 'Investing', 'Meta', 'Nvda', 'Stock', 'Technology', 'Technology And Telecom', 'Tiingo Top')",2026-06-04T21:21:50.510527Z,"('avgo', 'brcm', 'goog', 'googl', 'meta', 'meta', 'metv', 'nvda')"
96199746,2026-06-04T19:08:47Z,How Dell’s Hardware Boom Will Resurrect Meta Platforms Stock,https://finance.yahoo.com/markets/stocks/articles/dell-hardware-boom-resurrect-meta-190847911.html,"Dell’s record earnings prove that the corporate AI hardware buildout is finally in full swing. As new localized data centers plug in, they will inevitably need open-source ""brains"" to protect corporate data, making Meta's Llama the default and setting up META stock for a long-term breakout.",finance.yahoo.com,"('Big Tech', 'Data Centers', 'Dell', 'ETF', 'Hewlett Packard Enterprise', 'Mark Zuckerberg', 'Market Dynamics', 'Meta', 'Pharmaceutical Companies', 'Stock', 'Technology', 'Unknown Sector')",2026-06-05T01:33:33.316989Z,"('dell', 'dell', 'dvmt', 'goog', 'googl', 'hpe', 'meta', 'meta', 'metv', 'msft', 'nvda')"
96191452,2026-06-04T18:27:18Z,Broadcom Just Crashed 15%. Here's What It Means for Every AI Investor,https://www.fool.com/investing/2026/06/04/broadcom-just-crashed-15-heres-what-it-means-for-e/?source=iedfolrf0000001,"Three major AI and cybersecurity names just sold off after earnings, and the next move could decide whether the bull run continues.",fool.com,"('03Cd5Fa9-Fd0B-4B5C-9Cd7-0B2B8F779942', 'Avgo', 'Crwd', 'ETF', 'Investing', 'Meta', 'Msft', 'Panw', 'Stock', 'Technology', 'Technology And Telecom', 'Tiingo Top', 'Unknown Sector')",2026-06-04T18:54:29.221137Z,"('avgo', 'brcm', 'crwd', 'meta', 'meta', 'metv', 'msft', 'panw')"
96191241,2026-06-04T18:20:39Z,This Stock Won't Stay Cheap For Longer,https://www.fool.com/investing/2026/06/04/this-stock-wont-stay-cheap-for-longer/?source=iedfolrf0000001,"Google just raised $80 billion, and Meta's setup looks better than ever, but one AI infrastructure name may be the biggest opportunity of them all.",fool.com,"('64B15Eeb-34D3-4Bf7-9F64-92273Adf91F1', 'ETF', 'Goog', 'Googl', 'Investing', 'Meta', 'Msft', 'Nbis', 'Stock', 'Technology', 'Technology And Telecom')",2026-06-04T18:44:33.036253Z,"('goog', 'googl', 'meta', 'meta', 'metv', 'msft', 'nbis')"
96191563,2026-06-04T17:42:00Z,Broadcom Stock Drops After Record Q2 Results: Time to Buy the Dip?,https://www.zacks.com/commentary/2932624/broadcom-stock-drops-after-record-q2-results-time-to-buy-the-dip?cid=CS-ZC-FT-investment_ideas-2932624,,zacks.com,"('ETF', 'Investment Ideas', 'Stock', 'Technology')",2026-06-04T19:01:21.438609Z,"('avgo', 'brcm', 'googl', 'meta', 'meta', 'metv')"
96189309,2026-06-04T17:12:54Z,"Jim Cramer sees an opportunity in Broadcom's 15% plunge, with one key caveat",https://www.cnbc.com/2026/06/04/cramer-sees-an-opportunity-in-broadcoms-15percent-plunge-with-one-key-caveat.html,"""Every time there's been this kind of huge break in the stock, you have to buy it,"" Jim said.",cnbc.com,"('Breaking News: Markets', 'ETF', 'Investment Strategy', 'Markets', 'Stock', 'Technology', 'Tiingo Top')",2026-06-04T17:18:20.756500Z,"('avgo', 'brcm', 'googl', 'meta', 'meta', 'metv', 'soxx', 'xsd')"
96188098,2026-06-04T16:19:22Z,Zuckerberg Backs Down on AI Tracking After Meta Employee Revolt – But They’ll Still Get the Data They Need,https://finance.yahoo.com/markets/stocks/articles/zuckerberg-backs-down-ai-tracking-161922601.html,"Meta Platforms (NASDAQ:META) employees are facing a double whammy. Not only is the company going through mass, successive layoffs, but the remaining employees are now supposed to forego their privacy… to train an even better replacement. Reuters caught wind of what has been happening inside Meta, and it doesn’t bode well if you work using ... Zuckerberg Backs Down on AI Tracking After Meta Employee Revolt – But They’ll Still Get the Data They Need",finance.yahoo.com,"('ETF', 'Meta', 'Stock', 'Technology', 'Top 10 Ai Stocks')",2026-06-04T16:39:51.001140Z,"('goog', 'googl', 'meta', 'meta', 'metv', 'nvda')"
