id,publishedDate,title,url,description,source,tags,crawlDate,tickers
96187699,2026-06-04T16:11:34Z,1 Big Reason to Sell Meta Platforms Stock Above $650,https://finance.yahoo.com/markets/stocks/articles/1-big-reason-sell-meta-161134100.html,"Meta Platforms (NASDAQ:META) at $622.98 looks stretched on any rally toward $650, where the math behind its escalating AI capital bill stops working in shareholders’ favor. The stock has spent six months stuck in a corridor, and one structural concern overshadows an otherwise strong operating story. Meta runs the largest advertising network on the open ... 1 Big Reason to Sell Meta Platforms Stock Above $650",finance.yahoo.com,"('ETF', 'Free Cash Flow', 'Meta', 'Reality Labs', 'Stock', 'Strong Buy', 'Susan Li', 'Technology', 'Top 10 Stocks')",2026-06-04T16:24:47.819183Z,"('meta', 'meta', 'metv', 'nvda')"
96187290,2026-06-04T16:01:03Z,Broadcom sparks a chip stock sell-off. Is this the start of a bigger turn?,https://www.cnbc.com/2026/06/04/broadcoms-outlook-sparked-a-selloff-for-chip-stocks-heres-why.html,Signs pointed to this move being more about about taking profits off extreme highs than moderating AI demand.,cnbc.com,"('Consumer Cyclical', 'ETF', 'Investment Strategy', 'Stock', 'Stock Markets', 'Technology', 'Tiingo Top', 'Unknown Sector')",2026-06-04T16:08:28.872028Z,"('amzn', 'avgo', 'brcm', 'googl', 'intc', 'meta', 'meta', 'metv', 'msft', 'mu', 'nvda', 'sndk', 'sndk', 'soxx', 'xlk', 'xsd')"
96187128,2026-06-04T16:00:01Z,Long-term unemployment is surging in the U.S. There are hidden costs for workers and the economy,https://www.cnbc.com/2026/06/04/long-term-unemployment-economy-jobs.html,"Long-term unemployment can have ramifications on financial, emotional and family health that linger even after reentry into the workforce.",cnbc.com,"('Breaking News: Economy', 'Breaking News: Investing', 'Breaking News: Markets', 'ETF', 'Economy', 'Investment Strategy', 'Life', 'Markets', 'Personnel', 'Social Issues', 'Stock', 'Stock Markets', 'Technology', 'Tiingo Top', 'Unknown Sector')",2026-06-04T16:04:30.234394Z,"('life', 'life', 'meta', 'meta', 'metv')"
96187473,2026-06-04T15:56:45Z,Mark Zuckerberg gets real with Meta stock investors,https://finance.yahoo.com/markets/stocks/articles/mark-zuckerberg-gets-real-meta-155645041.html,"For the past two years, Wall Street has asked Meta the same question. The company has committed hundreds of billions of dollars to AI infrastructure, data centers, and custom chips. The returns have been real but indirect: better ad targeting, stronger engagement, and higher revenue from a business ...",finance.yahoo.com,"('Business Agent', 'Businesses', 'ETF', 'Mark Zuckerberg', 'Meta', 'Meta Business Agent', 'Meta Stock', 'Stock', 'Technology')",2026-06-04T16:14:36.331965Z,"('meta', 'meta', 'metv')"
96190160,2026-06-04T15:02:14Z,Meta Moves Forward With Its Controversial Plan to Track Employees — But There’s a Way Out,https://finance.yahoo.com/sectors/technology/articles/meta-moves-forward-controversial-plan-150214398.html,"Over 1,500 Meta employees signed a petition opposing the tracking system, which monitors keystrokes and mouse activity.",finance.yahoo.com,"('ETF', 'Internal Memo', 'Meta', 'Stock', 'Surveillance System', 'Technology')",2026-06-04T17:49:27.522142Z,"('meta', 'meta', 'metv')"
96184325,2026-06-04T14:24:15Z,"Tech Industry Loses 123,000 Jobs This Year—AI Is The Most Cited Reason For Layoffs",https://www.forbes.com/sites/maryroeloffs/2026/06/04/tech-industry-loses-123000-jobs-this-year-ai-is-the-most-cited-reason-for-layoffs/,"AI overtook market and economic conditions as the leading reason companies cited for cutting jobs in May, according to the most recent report from Challenger, Gray and Christmas.",forbes.com,"('Anthropic', 'Billionaire Ceo', 'Brian Armstrong', 'Coinbase', 'Dario Amodei', 'ETF', 'Meta', 'Oracle', 'Salesforce', 'Snapchat', 'Stock', 'Technology')",2026-06-04T14:28:10.830415Z,"('meta', 'meta', 'metv')"
96183892,2026-06-04T13:47:55Z,Meta says employees can now pause controversial workplace tracking – but only for 30 minutes,https://www.aol.com/news/meta-says-employees-now-pause-134755914.html,Employees describe surveillance software as ‘very dystopian’,aol.com,"('Artificial Intelligence', 'Data Privacy', 'ETF', 'Employee Data', 'Meta', 'Stock', 'Technology', 'Tracking Software')",2026-06-04T14:08:38.051293Z,"('meta', 'meta', 'metv')"
96182223,2026-06-04T13:06:00Z,Cathie Wood Goes Bargain Hunting: 3 Stocks She Just Bought,https://www.fool.com/investing/2026/06/04/cathie-wood-goes-bargain-hunting-3-stocks-she-just/?source=iedfolrf0000001,The popular growth investor keeps adding to some of her favorite stocks.,fool.com,"('3944A29B-57F2-41A8-B3E2-C8883F76Bf4F', 'Baba', 'Bidu', 'Consumer Cyclical', 'ETF', 'Goog', 'Googl', 'Investing', 'Meta', 'Stock', 'Technology', 'Technology And Telecom')",2026-06-04T13:27:41.770496Z,"('baba', 'bidu', 'goog', 'googl', 'meta', 'meta', 'metv')"
96181268,2026-06-04T12:30:00Z,"Prenetics Appoints Hudson Leogrande, Founder and CEO of Multi-Billion-Dollar DTC Brand Comfrt, to Board of Directors as IM8 Accelerates TikTok and Meta Expansion",https://finance.yahoo.com/sectors/healthcare/articles/prenetics-appoints-hudson-leogrande-founder-123000458.html,"Hudson Leogrande is the Founder and CEO of Comfrt — a multi-billion-dollar DTC brand projected to exceed $1 billion in revenue in 2026Comfrt is one of the largest advertisers on both TikTok and Meta; Comfrt’s 600,000-strong TikTok affiliate community drives organic cultural reach that unlocks Meta paid acquisitionMr. Leogrande joins David Beckham (Co-Founder), Giannis Antetokounmpo, Aryna Sabalenka, Ollie Bearman, Jay Shetty, and Inter Miami CF in supporting IM8 to redefine the global health and",finance.yahoo.com,"('Board Of Directors', 'Comfrt', 'Company', 'David Beckham', 'ETF', 'Financial Services', 'Giannis Antetokounmpo', 'Hudson Leogrande', 'Im8', 'Inter Miami Cf', 'Meta', 'Prenetics', 'Stock', 'Technology', 'The Company', 'Tiktok Shop', 'Unknown Sector')",2026-06-04T12:55:48.586374Z,"('aaba', 'meta', 'meta', 'metv', 'pre', 'yhoo')"
96180382,2026-06-04T12:22:24Z,Thai watchdog to sue Meta over Facebook scam ads targeting users,https://www.channelnewsasia.com/asia/thai-watchdog-sue-meta-facebook-scam-ads-6162421,"BANGKOK: Thailand's consumer watchdog said it will sue Meta's Facebook for allegedly allowing scammers to use the platform to defraud users through adverts and for failing to protect consumers, the Consumer Council said on Thursday (Jun 4).Meta did not immediately respond to a Reuters request for comment.&nbs",channelnewsasia.com,"('ETF', 'Facebook', 'Meta', 'Scam', 'Stock', 'Technology', 'Thailand')",2026-06-04T12:26:15.539343Z,"('meta', 'meta', 'metv')"
96178281,2026-06-04T11:11:01Z,Bluesky was launched as a Twitter rival — now it wants to be more like Reddit,https://www.cnbc.com/2026/06/04/bluesky-twitter-rival-reddit-social-media.html,"""I think the public square is not the direction we want to go in...we're very inspired by companies like Reddit,"" Bluesky's Rose Wang told CNBC.",cnbc.com,"('Breaking News: Technology', 'Business', 'Consumer Cyclical', 'ETF', 'Entertainment', 'Media', 'Publishing', 'Social Media', 'Stock', 'Technology', 'Television', 'Unknown Sector')",2026-06-04T11:18:13.113240Z,"('meta', 'meta', 'metv', 'rddt', 'tsla', 'twtr')"
96177902,2026-06-04T11:00:01Z,"As the largest World Cup ever kicks off, health officials are focused on more than Ebola",https://www.cnbc.com/2026/06/04/world-cup-2026-health-officials-focused-on-ebola-measles.html,"Officials are more concerned about highly contagious diseases like measles and respiratory viruses, which can spread quickly through large, fast-moving crowds.",cnbc.com,"('Biotech And Pharmaceuticals', 'Biotechnology', 'Breaking News: Business', 'Business', 'Computing', 'ETF', 'Health Care Industry', 'Internet', 'Pharmaceuticals', 'Social Issues', 'Stock', 'Technology', 'Wireless')",2026-06-04T11:03:23.004067Z,"('googl', 'meta', 'meta', 'metv')"
96178418,2026-06-04T11:00:00Z,Will AI Productivity Gains Allow Fed Chair Kevin Warsh to Cut Interest Rates?,https://www.fool.com/investing/2026/06/04/ai-productivity-gains-fed-kevin-warsh-cut-rates/?source=iedfolrf0000001,Massive AI infrastructure spending remains inflationary at the moment.,fool.com,"('1Ff41818-58B8-40Bc-8C84-A7A2D972Bd87', 'ETF', 'Investing', 'Markets', 'Meta', 'Msft', 'Stock', 'Technology')",2026-06-04T11:24:44.781362Z,"('meta', 'meta', 'metv', 'msft')"
96178269,2026-06-04T10:53:30Z,Thailand watchdog plans legal action against Meta's Facebook for failing to protect against scammers,https://finance.yahoo.com/markets/crypto/articles/thailand-watchdog-plans-legal-action-105330077.html,"At Yahoo Finance, you get free stock quotes, up-to-date news, portfolio management resources, international market data, social interaction and mortgage rates that help you manage your financial life.",finance.yahoo.com,"('Consumer \u200cWatchdog', 'ETF', 'Facebook', 'Meta', 'Scammers', 'Social Media', 'Stock', 'Technology', 'Thailand')",2026-06-04T11:18:03.709827Z,"('meta', 'meta', 'metv')"
96179545,2026-06-04T10:29:51Z,"MSH Capital Advisors LLC Grows Stake in Meta Platforms, Inc. $META",https://www.thelincolnianonline.com/2026/06/04/msh-capital-advisors-llc-grows-stake-in-meta-platforms-inc-meta.html,"MSH Capital Advisors LLC lifted its position in Meta Platforms, Inc. (NASDAQ:META – Free Report) by 65.9% during the fourth quarter, HoldingsChannel.com reports. The institutional investor owned 2,291 shares of the social networking company’s stock after purchasing an additional 910 shares during the period. MSH Capital Advisors LLC’s holdings in Meta Platforms were worth $1,512,000 […]",thelincolnianonline.com,"('13F', '30303M10', 'Computer And Technology', 'ETF', 'Financial Services', 'Hedge Fund Holdings', 'Institutional Investor Holdings', 'Meta', 'Meta Platforms', 'Nasdaq:Meta', 'Sec Filings', 'Stock', 'Technology', 'Unknown Sector')",2026-06-04T12:02:21.198890Z,"('bcs', 'jpm', 'jpm-ws', 'meta', 'meta', 'metv', 'wfc', 'wfc-ws')"
96175820,2026-06-04T09:20:26Z,"Meta Platforms, Inc. $META Shares Sold by Capital Management Associates NY",https://www.thelincolnianonline.com/2026/06/04/meta-platforms-inc-meta-shares-sold-by-capital-management-associates-ny.html,"Capital Management Associates NY lessened its stake in shares of Meta Platforms, Inc. (NASDAQ:META – Free Report) by 37.1% in the fourth quarter, according to its most recent filing with the SEC. The fund owned 2,200 shares of the social networking company’s stock after selling 1,300 shares during the period. Meta Platforms comprises about 2.1% […]",thelincolnianonline.com,"('13F', '30303M10', 'Computer And Technology', 'ETF', 'Financial Services', 'Hedge Fund Holdings', 'Institutional Investor Holdings', 'Meta', 'Meta Platforms', 'Nasdaq:Meta', 'Sec Filings', 'Stock', 'Technology')",2026-06-04T09:30:54.065506Z,"('all', 'bcs', 'key', 'meta', 'meta', 'metv')"
96175628,2026-06-04T08:48:00Z,SpaceX IPO: 2 Alarming Statistics Investors Must See Before Buying the Stock,https://www.fool.com/investing/2026/06/04/spacex-ipo-2-alarming-statistics-before-buy-stock/?source=iedfolrf0000001,History says SpaceX will be a very risky stock when it starts trading later this month.,fool.com,"('7Dcad55F-43De-463C-Af6A-Eef71075E84E', 'ETF', 'Fds', 'Financial Services', 'Industrials', 'Investing', 'Markets', 'Meta', 'Morn', 'Pltr', 'Stock', 'Technology', 'Uber', 'Unknown Sector', '^Gspc')",2026-06-04T09:21:44.833339Z,"('fds', 'meta', 'meta', 'metv', 'morn', 'pltr', 'spcx', 'uber')"
96175675,2026-06-04T07:56:00Z,"Zacks Investment Ideas feature highlights: Nvidia, Alphabet, Meta, Dell, Hewlett and Oracle",https://www.zacks.com/stock/news/2931975/zacks-investment-ideas-feature-highlights-nvidia-alphabet-meta-dell-hewlett-and-oracle?cid=CS-ZC-FT-press_releases-2931975,,zacks.com,"('ETF', 'Press Releases', 'Stock', 'Technology', 'Unknown Sector')",2026-06-04T09:24:25.515421Z,"('dell', 'dell', 'googl', 'meta', 'meta', 'metv', 'nvda', 'orcl')"
96173753,2026-06-04T06:35:10Z,Daily Open: Stock markets sense a shift,https://www.cnbc.com/2026/06/04/cnbc-daily-open-stock-markets-sense-a-shift.html,"Global stocks are under pressure despite oil easing after a ceasefire between Israel and Lebanon, while investors anticipate SpaceX's IPO.",cnbc.com,"('Collusion', 'Consumer Cyclical', 'ETF', 'Financial Services', 'Foreign Policy', 'Government Debt', 'Industrials', 'Israel', 'Lebanon', 'Markets', 'Securities Fraud', 'Stock', 'Technology', 'Tiingo Top', 'Unknown Sector', 'World Markets')",2026-06-04T06:39:22.312384Z,"('aapl', 'amzn', 'arm', 'botz', 'csco', 'dell', 'dell', 'googl', 'hsbc', 'hxscl', 'meta', 'meta', 'metv', 'msft', 'mu', 'nio', 'nio1', 'nvda', 'qqq', 'ryaay', 'soxx', 'spcx', 'tm', 'tmhc', 'tsla', 'uber', 'xsd')"
96176648,2026-06-04T05:46:56Z,"Breaking convention, SpaceX sets IPO price before roadshow",https://fortune.com/2026/06/04/spacex-ipo-price/,"Plus: Baidu, Europol, Kunlunxin, Meta, Netflix, Palantir, Suno, YouTube.",fortune.com,"('Alphabet', 'Antitrust', 'Baidu', 'China', 'Consumer Cyclical', 'ETF', 'Elon Musk', 'Fortune Tech', 'Google', 'Ipos', 'Meta', 'Netflix', 'No Copyright', 'Openai', 'Palantir', 'Palantir Technologies', 'Semiconductors', 'Spacex', 'Stock', 'Technology', 'United Kingdom', 'Unknown Sector', 'Youtube')",2026-06-04T10:03:45.353329Z,"('meta', 'meta', 'metv', 'nflx', 'spcx')"
96173301,2026-06-04T05:18:00Z,3 Top Bargain Artificial Intelligence (AI) Stocks to Buy Right Now,https://www.fool.com/investing/2026/06/04/3-top-bargain-ai-stocks-to-buy-right-now/?source=iedfolrf0000001,"Considering these tech companies' strengths, Nvidia, Meta Platforms, and Sandisk are trading at cheaper levels than you'd expect.",fool.com,"('68413A5D-1061-4Bd5-Bbe1-3C30B7A43Fa3', 'ETF', 'Investing', 'Meta', 'Nvda', 'Sndk', 'Stock', 'Technology', 'Technology And Telecom', 'Unknown Sector')",2026-06-04T05:48:34.853720Z,"('meta', 'meta', 'metv', 'nvda', 'sndk', 'sndk')"
96172765,2026-06-04T05:00:01Z,Finland's president says EU should expand to 40 states — including Canada,https://www.cnbc.com/2026/06/04/finland-stubb-eu-canada-turkey-norway.html,Finnish President Alexander Stubb said the European Union needs to expand to project power on the global stage.,cnbc.com,"('Breaking News: Politics', 'Canada', 'ETF', 'Finland', 'Foreign Policy', 'Politics', 'Stock', 'Technology', 'Unknown Sector')",2026-06-04T05:03:27.177870Z,"('googl', 'gpja', 'meta', 'meta', 'metv', 'tur', 'vgk', 'xlk')"
96172260,2026-06-04T03:53:50Z,"Meta repeatedly pushes back new AI model release for developers, WSJ says",https://finance.yahoo.com/sectors/technology/articles/meta-repeatedly-pushes-back-ai-035350756.html,"Meta has repeatedly pushed back plans to release its new Muse ‌Spark AI model API to developers, ‌and as of Tuesday, had no scheduled launch date, the ​Wall Street Journal reported, citing people familiar with the matter.  A Meta spokesperson told Reuters on Wednesday that the company is already testing the ‌Application Programming Interface (API) ⁠with some early partners and is looking forward to releasing it this ⁠month.  An API is a type of software interface that determines how two software systems will interact.",finance.yahoo.com,"('Application Programming Interface', 'ETF', 'Meta', 'Muse Spark', 'Spark', 'Stock', 'Technology')",2026-06-04T04:15:11.412246Z,"('goog', 'googl', 'meta', 'meta', 'metv')"
96171869,2026-06-04T03:30:03Z,"Florida Lottery Powerball, Fantasy 5 results for June 3, 2026",https://www.aol.com/news/florida-lottery-powerball-fantasy-5-033003296.html,Check your tickets for Florida daily lottery draw games here.,aol.com,"('ETF', 'Fb', 'Florida Lottery', 'Powerball', 'Stock', 'Technology', 'Unknown Sector', 'Winning Fantasy 5 Numbers', 'Winning Pick 3 Numbers', 'Winning Pick 4 Numbers')",2026-06-04T03:48:30.745829Z,"('fb', 'meta')"
96171007,2026-06-04T02:11:00Z,Big Tech's AI Spending Is on Track to Top $700 Billion This Year. Here's Who May Cash In Next.,https://www.fool.com/investing/2026/06/03/big-techs-ai-spending-is-on-track-to-top-700-billi/?source=iedfolrf0000001,"As the hyperscalers pour record sums into data centers, the electric utilities that power them are emerging as an overlooked way to play the boom.",fool.com,"('00A7E7D4-2586-4Cc5-Bad5-0C65C78C46Bb', 'Aep', 'Amzn', 'Consumer Cyclical', 'ETF', 'Goog', 'Googl', 'Investing', 'Meta', 'Msft', 'Stock', 'Technology', 'Technology And Telecom', 'Tiingo Top', 'Utilities')",2026-06-04T02:34:29.980075Z,"('aep', 'amzn', 'goog', 'googl', 'meta', 'meta', 'metv', 'msft')"
96170556,2026-06-04T01:49:46Z,Daily Open: Iran war worries halt stock rally,https://www.cnbc.com/2026/06/04/cnbc-daily-open-iran-war-worries-halt-stock-rally.html,Oil prices rise and markets fall after Netanyahu tells CNBC Israel and U.S. prepared to attack Iran again if necessary.,cnbc.com,"('Asia Economy', 'Basic Materials', 'Breaking News: Economy', 'Consumer Cyclical', 'Consumer Discretionary', 'ETF', 'Economy', 'Energy', 'Financial Services', 'Foreign Policy', 'Industrials', 'Iran', 'Israel', 'Prices', 'Stock', 'Technology', 'Tiingo Top', 'Unknown Sector')",2026-06-04T01:52:19.036965Z,"('aal', 'aapl', 'aeo', 'amzn', 'arkk', 'avgo', 'ba', 'baba', 'bno', 'cf', 'cop', 'crwd', 'cvx', 'dal', 'dbo', 'dell', 'dell', 'ewh', 'ewj', 'ews', 'ewu', 'ewy', 'fdn', 'fdx', 'gap', 'googl', 'gs', 'igv', 'intu', 'ixc', 'kwt', 'kwt', 'lmt', 'mchi', 'meta', 'meta', 'metv', 'mos', 'mrvl', 'msft', 'noc', 'ntr', 'nvda', 'orcl', 'oxy', 'qqq', 'ryaay', 'shel', 'shel', 'skyy', 'snow', 'snow', 'socl', 'soxx', 'thd', 'tsla', 'tsm', 'tte', 'tte', 'ual', 'uco', 'uga', 'vgk', 'wday', 'xar', 'xlk', 'xom')"
96169242,2026-06-04T00:06:10Z,Meta lashes Australia's bid to make tech giants pay for news,https://finance.yahoo.com/economy/policy/articles/meta-lashes-australias-bid-tech-000610630.html,"Tech giant Meta on Thursday attacked Australia's ""grossly unfair"" bid to make social media companies pay for news, saying it is vehemently opposed to the draft laws.""Our position is clear: this law is poorly designed, grossly unfair, and will fail to deliver a diverse and sustainable news industry,"" said Meta, the parent company of Facebook and Instagram.",finance.yahoo.com,"('Anthony Albanese', 'Australia', 'Australian Journalists', 'ETF', 'Foreign Companies', 'Local', 'Meta', 'Publishers', 'Social Media Companies', 'Stock', 'Tech Companies', 'Technology', 'Traditional Media Companies')",2026-06-04T00:18:00.117724Z,"('goog', 'googl', 'meta', 'meta', 'metv')"
96169024,2026-06-04T00:00:02Z,"Amazon engineers in Seattle slam employer for building AI data centers while laying off 30,000 staffers",https://www.cnbc.com/2026/06/03/amazon-engineers-in-seattle-slam-employer-for-ai-data-amid-layoffs.html,Amazon engineers called out their employer for conducting mass layoffs while it commits to spending $200 billion this year on AI infrastructure.,cnbc.com,"('Breaking News: Technology', 'Business', 'Computing', 'Consumer Cyclical', 'ETF', 'Enterprise', 'Environment', 'Internet', 'Personnel', 'Stock', 'Technology', 'Wireless')",2026-06-04T00:03:33.087715Z,"('amzn', 'googl', 'meta', 'meta', 'metv', 'msft')"
